0x0100: 0x00, A 0, B 0, C 0, D 0, E 0, F 0, H 0, L 0
0x0100: NOP
0x0101: 0xc3, A 0, B 0, C 0, D 0, E 0, F 0, H 0, L 0
0x0101: Jumping to 0x5001
0x5001: 0x2c, A 0, B 0, C 0, D 0, E 0, F 0, H 0, L 0
0x5001: Register L Increased to 0x01
0x5002: 0x2c, A 0, B 0, C 0, D 0, E 0, F 0, H 0, L 1
0x5002: Register L Increased to 0x02
0x5003: 0x53, A 0, B 0, C 0, D 0, E 0, F 0, H 0, L 2
0x5003: Loading 0x00 from Register E to Register D
0x5004: 0x11, A 0, B 0, C 0, D 0, E 0, F 0, H 0, L 2
0x5004: Loading 0x1210 to Register DE
    D: 0x12 | E: 0x10
0x5007: 0x11, A 0, B 0, C 0, D 18, E 16, F 0, H 0, L 2
0x5007: Loading 0x542c to Register DE
    D: 0x54 | E: 0x2c
0x500a: 0x4b, A 0, B 0, C 0, D 84, E 44, F 0, H 0, L 2
0x500a: Loading 0x2c from Register E to Register C
0x500b: 0x4a, A 0, B 0, C 44, D 84, E 44, F 0, H 0, L 2
0x500b: Loading 0x54 from Register D to Register C
0x500c: 0x55, A 0, B 0, C 84, D 84, E 44, F 0, H 0, L 2
0x500c: Loading 0x02 from Register L to Register D
0x500d: 0x56, A 0, B 0, C 84, D 2, E 44, F 0, H 0, L 2
0x500d: Setting value 0x00 to register D from location 0x0002
0x500e: 0x57, A 0, B 0, C 84, D 0, E 44, F 0, H 0, L 2
0x500e: Loading 0x00 from Register A to Register D
0x500f: 0x58, A 0, B 0, C 84, D 0, E 44, F 0, H 0, L 2
0x500f: Loading 0x00 from Register B to Register E
0x5010: 0x6c, A 0, B 0, C 84, D 0, E 0, F 0, H 0, L 2
0x5010: Loading 0x00 from Register H to Register L
0x5011: 0x58, A 0, B 0, C 84, D 0, E 0, F 0, H 0, L 0
0x5011: Loading 0x00 from Register B to Register E
0x5012: 0x6c, A 0, B 0, C 84, D 0, E 0, F 0, H 0, L 0
0x5012: Loading 0x00 from Register H to Register L
0x5013: 0x58, A 0, B 0, C 84, D 0, E 0, F 0, H 0, L 0
0x5013: Loading 0x00 from Register B to Register E
0x5014: 0x59, A 0, B 0, C 84, D 0, E 0, F 0, H 0, L 0
0x5014: Loading 0x54 from Register C to Register E
0x5015: 0x56, A 0, B 0, C 84, D 0, E 84, F 0, H 0, L 0
0x5015: Setting value 0x00 to register D from location 0x0000
0x5016: 0x5a, A 0, B 0, C 84, D 0, E 84, F 0, H 0, L 0
0x5016: Loading 0x00 from Register D to Register E
0x5017: 0x75, A 0, B 0, C 84, D 0, E 0, F 0, H 0, L 0
0x5017: Loading 0x00 from Register L to (HL)
0x5018: 0x58, A 0, B 0, C 84, D 0, E 0, F 0, H 0, L 0
0x5018: Loading 0x00 from Register B to Register E
0x5019: 0x6c, A 0, B 0, C 84, D 0, E 0, F 0, H 0, L 0
0x5019: Loading 0x00 from Register H to Register L
0x501a: 0x58, A 0, B 0, C 84, D 0, E 0, F 0, H 0, L 0
0x501a: Loading 0x00 from Register B to Register E
0x501b: 0x6c, A 0, B 0, C 84, D 0, E 0, F 0, H 0, L 0
0x501b: Loading 0x00 from Register H to Register L
0x501c: 0x6e, A 0, B 0, C 84, D 0, E 0, F 0, H 0, L 0
0x501c: Setting value 0x00 to register L from location 0x0000
0x501d: 0x5a, A 0, B 0, C 84, D 0, E 0, F 0, H 0, L 0
0x501d: Loading 0x00 from Register D to Register E
0x501e: 0x4b, A 0, B 0, C 84, D 0, E 0, F 0, H 0, L 0
0x501e: Loading 0x00 from Register E to Register C
0x501f: 0x4a, A 0, B 0, C 0, D 0, E 0, F 0, H 0, L 0
0x501f: Loading 0x00 from Register D to Register C
0x5020: 0x5b, A 0, B 0, C 0, D 0, E 0, F 0, H 0, L 0
0x5020: Loading 0x00 from Register E to Register E
0x5021: 0x90, A 0, B 0, C 0, D 0, E 0, F 0, H 0, L 0
0x5021: Subtracting Register B's value (0x00) from Register A (0x00)
0x5022: 0x6f, A 0, B 0, C 0, D 0, E 0, F 192, H 0, L 0
0x5022: Loading 0x00 from Register A to Register L
0x5023: 0x91, A 0, B 0, C 0, D 0, E 0, F 192, H 0, L 0
0x5023: Subtracting Register C's value (0x00) from Register A (0x00)
0x5024: 0x6f, A 0, B 0, C 0, D 0, E 0, F 192, H 0, L 0
0x5024: Loading 0x00 from Register A to Register L
0x5025: 0x92, A 0, B 0, C 0, D 0, E 0, F 192, H 0, L 0
0x5025: Subtracting Register D's value (0x00) from Register A (0x00)
0x5026: 0x6f, A 0, B 0, C 0, D 0, E 0, F 192, H 0, L 0
0x5026: Loading 0x00 from Register A to Register L
0x5027: 0x93, A 0, B 0, C 0, D 0, E 0, F 192, H 0, L 0
0x5027: Subtracting Register E's value (0x00) from Register A (0x00)
0x5028: 0x6f, A 0, B 0, C 0, D 0, E 0, F 192, H 0, L 0
0x5028: Loading 0x00 from Register A to Register L
0x5029: 0x94, A 0, B 0, C 0, D 0, E 0, F 192, H 0, L 0
0x5029: Subtracting Register H's value (0x00) from Register A (0x00)
0x502a: 0x5c, A 0, B 0, C 0, D 0, E 0, F 192, H 0, L 0
0x502a: Loading 0x00 from Register H to Register E
0x502b: 0x5b, A 0, B 0, C 0, D 0, E 0, F 192, H 0, L 0
0x502b: Loading 0x00 from Register E to Register E
0x502c: 0x90, A 0, B 0, C 0, D 0, E 0, F 192, H 0, L 0
0x502c: Subtracting Register B's value (0x00) from Register A (0x00)
0x502d: 0x6f, A 0, B 0, C 0, D 0, E 0, F 192, H 0, L 0
0x502d: Loading 0x00 from Register A to Register L
0x502e: 0x91, A 0, B 0, C 0, D 0, E 0, F 192, H 0, L 0
0x502e: Subtracting Register C's value (0x00) from Register A (0x00)
0x502f: 0x6f, A 0, B 0, C 0, D 0, E 0, F 192, H 0, L 0
0x502f: Loading 0x00 from Register A to Register L
0x5030: 0x92, A 0, B 0, C 0, D 0, E 0, F 192, H 0, L 0
0x5030: Subtracting Register D's value (0x00) from Register A (0x00)
0x5031: 0x5c, A 0, B 0, C 0, D 0, E 0, F 192, H 0, L 0
0x5031: Loading 0x00 from Register H to Register E
0x5032: 0x4b, A 0, B 0, C 0, D 0, E 0, F 192, H 0, L 0
0x5032: Loading 0x00 from Register E to Register C
0x5033: 0x4a, A 0, B 0, C 0, D 0, E 0, F 192, H 0, L 0
0x5033: Loading 0x00 from Register D to Register C
0x5034: 0x71, A 0, B 0, C 0, D 0, E 0, F 192, H 0, L 0
0x5034: Loading 0x00 from Register C to (HL)
0x5035: 0x72, A 0, B 0, C 0, D 0, E 0, F 192, H 0, L 0
0x5035: Loading 0x00 from Register D to (HL)
0x5036: 0x73, A 0, B 0, C 0, D 0, E 0, F 192, H 0, L 0
0x5036: Loading 0x00 from Register E to (HL)
0x5037: 0x72, A 0, B 0, C 0, D 0, E 0, F 192, H 0, L 0
0x5037: Loading 0x00 from Register D to (HL)
0x5038: 0x73, A 0, B 0, C 0, D 0, E 0, F 192, H 0, L 0
0x5038: Loading 0x00 from Register E to (HL)
0x5039: 0x72, A 0, B 0, C 0, D 0, E 0, F 192, H 0, L 0
0x5039: Loading 0x00 from Register D to (HL)
0x503a: 0x73, A 0, B 0, C 0, D 0, E 0, F 192, H 0, L 0
0x503a: Loading 0x00 from Register E to (HL)
0x503b: 0x72, A 0, B 0, C 0, D 0, E 0, F 192, H 0, L 0
0x503b: Loading 0x00 from Register D to (HL)
0x503c: 0x73, A 0, B 0, C 0, D 0, E 0, F 192, H 0, L 0
0x503c: Loading 0x00 from Register E to (HL)
0x503d: 0x72, A 0, B 0, C 0, D 0, E 0, F 192, H 0, L 0
0x503d: Loading 0x00 from Register D to (HL)
0x503e: 0x74, A 0, B 0, C 0, D 0, E 0, F 192, H 0, L 0
0x503e: Loading 0x00 from Register H to (HL)
0x503f: 0x71, A 0, B 0, C 0, D 0, E 0, F 192, H 0, L 0
0x503f: Loading 0x00 from Register C to (HL)
0x5040: 0x72, A 0, B 0, C 0, D 0, E 0, F 192, H 0, L 0
0x5040: Loading 0x00 from Register D to (HL)
0x5041: 0x73, A 0, B 0, C 0, D 0, E 0, F 192, H 0, L 0
0x5041: Loading 0x00 from Register E to (HL)
0x5042: 0x72, A 0, B 0, C 0, D 0, E 0, F 192, H 0, L 0
0x5042: Loading 0x00 from Register D to (HL)
0x5043: 0x73, A 0, B 0, C 0, D 0, E 0, F 192, H 0, L 0
0x5043: Loading 0x00 from Register E to (HL)
0x5044: 0x72, A 0, B 0, C 0, D 0, E 0, F 192, H 0, L 0
0x5044: Loading 0x00 from Register D to (HL)
0x5045: 0x74, A 0, B 0, C 0, D 0, E 0, F 192, H 0, L 0
0x5045: Loading 0x00 from Register H to (HL)
0x5046: 0x4b, A 0, B 0, C 0, D 0, E 0, F 192, H 0, L 0
0x5046: Loading 0x00 from Register E to Register C
0x5047: 0x4a, A 0, B 0, C 0, D 0, E 0, F 192, H 0, L 0
0x5047: Loading 0x00 from Register D to Register C
0x5048: 0x5b, A 0, B 0, C 0, D 0, E 0, F 192, H 0, L 0
0x5048: Loading 0x00 from Register E to Register E
0x5049: 0x95, A 0, B 0, C 0, D 0, E 0, F 192, H 0, L 0
0x5049: Subtracting Register L's value (0x00) from Register A (0x00)
0x504a: 0x6f, A 0, B 0, C 0, D 0, E 0, F 192, H 0, L 0
0x504a: Loading 0x00 from Register A to Register L
0x504b: 0x96, A 0, B 0, C 0, D 0, E 0, F 192, H 0, L 0
0x504b: Not Implemented
0x504c: 0x6f, A 0, B 0, C 0, D 0, E 0, F 192, H 0, L 0
0x504c: Loading 0x00 from Register A to Register L
0x504d: 0x97, A 0, B 0, C 0, D 0, E 0, F 192, H 0, L 0
0x504d: Subtracting Register A's value (0x00) from Register A (0x00)
0x504e: 0x6f, A 0, B 0, C 0, D 0, E 0, F 192, H 0, L 0
0x504e: Loading 0x00 from Register A to Register L
0x504f: 0x98, A 0, B 0, C 0, D 0, E 0, F 192, H 0, L 0
0x504f: Not Implemented
0x5050: 0x6f, A 0, B 0, C 0, D 0, E 0, F 192, H 0, L 0
0x5050: Loading 0x00 from Register A to Register L
0x5051: 0x99, A 0, B 0, C 0, D 0, E 0, F 192, H 0, L 0
0x5051: Not Implemented
0x5052: 0x5c, A 0, B 0, C 0, D 0, E 0, F 192, H 0, L 0
0x5052: Loading 0x00 from Register H to Register E
0x5053: 0x5b, A 0, B 0, C 0, D 0, E 0, F 192, H 0, L 0
0x5053: Loading 0x00 from Register E to Register E
0x5054: 0x93, A 0, B 0, C 0, D 0, E 0, F 192, H 0, L 0
0x5054: Subtracting Register E's value (0x00) from Register A (0x00)
0x5055: 0x6f, A 0, B 0, C 0, D 0, E 0, F 192, H 0, L 0
0x5055: Loading 0x00 from Register A to Register L
0x5056: 0x94, A 0, B 0, C 0, D 0, E 0, F 192, H 0, L 0
0x5056: Subtracting Register H's value (0x00) from Register A (0x00)
0x5057: 0x6f, A 0, B 0, C 0, D 0, E 0, F 192, H 0, L 0
0x5057: Loading 0x00 from Register A to Register L
0x5058: 0x95, A 0, B 0, C 0, D 0, E 0, F 192, H 0, L 0
0x5058: Subtracting Register L's value (0x00) from Register A (0x00)
0x5059: 0x5c, A 0, B 0, C 0, D 0, E 0, F 192, H 0, L 0
0x5059: Loading 0x00 from Register H to Register E
0x505a: 0x4b, A 0, B 0, C 0, D 0, E 0, F 192, H 0, L 0
0x505a: Loading 0x00 from Register E to Register C
0x505b: 0x4a, A 0, B 0, C 0, D 0, E 0, F 192, H 0, L 0
0x505b: Loading 0x00 from Register D to Register C
0x505c: 0x2d, A 0, B 0, C 0, D 0, E 0, F 192, H 0, L 0
0x505c: Register L Decreased to 255
0x505d: 0x4f, A 0, B 0, C 0, D 0, E 0, F 224, H 0, L 255
0x505d: Loading 0x00 from Register A to Register C
0x505e: 0x6b, A 0, B 0, C 0, D 0, E 0, F 224, H 0, L 255
0x505e: Loading 0x00 from Register E to Register L
0x505f: 0x4f, A 0, B 0, C 0, D 0, E 0, F 224, H 0, L 0
0x505f: Loading 0x00 from Register A to Register C
0x5060: 0x6b, A 0, B 0, C 0, D 0, E 0, F 224, H 0, L 0
0x5060: Loading 0x00 from Register E to Register L
0x5061: 0x4f, A 0, B 0, C 0, D 0, E 0, F 224, H 0, L 0
0x5061: Loading 0x00 from Register A to Register C
0x5062: 0x6b, A 0, B 0, C 0, D 0, E 0, F 224, H 0, L 0
0x5062: Loading 0x00 from Register E to Register L
0x5063: 0x4f, A 0, B 0, C 0, D 0, E 0, F 224, H 0, L 0
0x5063: Loading 0x00 from Register A to Register C
0x5064: 0x6b, A 0, B 0, C 0, D 0, E 0, F 224, H 0, L 0
0x5064: Loading 0x00 from Register E to Register L
0x5065: 0x4f, A 0, B 0, C 0, D 0, E 0, F 224, H 0, L 0
0x5065: Loading 0x00 from Register A to Register C
0x5066: 0x2e, A 0, B 0, C 0, D 0, E 0, F 224, H 0, L 0
0x5066: Loading 0x002d to Register L
0x5068: 0x4f, A 0, B 0, C 0, D 0, E 0, F 224, H 0, L 45
0x5068: Loading 0x00 from Register A to Register C
0x5069: 0x6b, A 0, B 0, C 0, D 0, E 0, F 224, H 0, L 45
0x5069: Loading 0x00 from Register E to Register L
0x506a: 0x4f, A 0, B 0, C 0, D 0, E 0, F 224, H 0, L 0
0x506a: Loading 0x00 from Register A to Register C
0x506b: 0x6b, A 0, B 0, C 0, D 0, E 0, F 224, H 0, L 0
0x506b: Loading 0x00 from Register E to Register L
0x506c: 0x4f, A 0, B 0, C 0, D 0, E 0, F 224, H 0, L 0
0x506c: Loading 0x00 from Register A to Register C
0x506d: 0x2e, A 0, B 0, C 0, D 0, E 0, F 224, H 0, L 0
0x506d: Loading 0x004b to Register L
0x506f: 0x4a, A 0, B 0, C 0, D 0, E 0, F 224, H 0, L 75
0x506f: Loading 0x00 from Register D to Register C
0x5070: 0x2c, A 0, B 0, C 0, D 0, E 0, F 224, H 0, L 75
0x5070: Register L Increased to 0x4c
0x5071: 0x2c, A 0, B 0, C 0, D 0, E 0, F 160, H 0, L 76
0x5071: Register L Increased to 0x4d
0x5072: 0x2c, A 0, B 0, C 0, D 0, E 0, F 160, H 0, L 77
0x5072: Register L Increased to 0x4e
0x5073: 0x50, A 0, B 0, C 0, D 0, E 0, F 160, H 0, L 78
0x5073: Loading 0x00 from Register B to Register D
0x5074: 0x51, A 0, B 0, C 0, D 0, E 0, F 160, H 0, L 78
0x5074: Loading 0x00 from Register C to Register D
0x5075: 0x51, A 0, B 0, C 0, D 0, E 0, F 160, H 0, L 78
0x5075: Loading 0x00 from Register C to Register D
0x5076: 0x51, A 0, B 0, C 0, D 0, E 0, F 160, H 0, L 78
0x5076: Loading 0x00 from Register C to Register D
0x5077: 0x51, A 0, B 0, C 0, D 0, E 0, F 160, H 0, L 78
0x5077: Loading 0x00 from Register C to Register D
0x5078: 0x51, A 0, B 0, C 0, D 0, E 0, F 160, H 0, L 78
0x5078: Loading 0x00 from Register C to Register D
0x5079: 0x51, A 0, B 0, C 0, D 0, E 0, F 160, H 0, L 78
0x5079: Loading 0x00 from Register C to Register D
0x507a: 0x51, A 0, B 0, C 0, D 0, E 0, F 160, H 0, L 78
0x507a: Loading 0x00 from Register C to Register D
0x507b: 0x51, A 0, B 0, C 0, D 0, E 0, F 160, H 0, L 78
0x507b: Loading 0x00 from Register C to Register D
0x507c: 0x51, A 0, B 0, C 0, D 0, E 0, F 160, H 0, L 78
0x507c: Loading 0x00 from Register C to Register D
0x507d: 0x52, A 0, B 0, C 0, D 0, E 0, F 160, H 0, L 78
0x507d: Loading 0x00 from Register D to Register D
0x507e: 0x2c, A 0, B 0, C 0, D 0, E 0, F 160, H 0, L 78
0x507e: Register L Increased to 0x4f
0x507f: 0x2c, A 0, B 0, C 0, D 0, E 0, F 160, H 0, L 79
0x507f: Register L Increased to 0x50
0x5080: 0x2c, A 0, B 0, C 0, D 0, E 0, F 160, H 0, L 80
0x5080: Register L Increased to 0x51
0x5081: 0x2c, A 0, B 0, C 0, D 0, E 0, F 160, H 0, L 81
0x5081: Register L Increased to 0x52
0x5082: 0x4b, A 0, B 0, C 0, D 0, E 0, F 160, H 0, L 82
0x5082: Loading 0x00 from Register E to Register C
0x5083: 0x4a, A 0, B 0, C 0, D 0, E 0, F 160, H 0, L 82
0x5083: Loading 0x00 from Register D to Register C
0x5084: 0x2c, A 0, B 0, C 0, D 0, E 0, F 160, H 0, L 82
0x5084: Register L Increased to 0x53
0x5085: 0x2c, A 0, B 0, C 0, D 0, E 0, F 160, H 0, L 83
0x5085: Register L Increased to 0x54
0x5086: 0x2c, A 0, B 0, C 0, D 0, E 0, F 160, H 0, L 84
0x5086: Register L Increased to 0x55
0x5087: 0x53, A 0, B 0, C 0, D 0, E 0, F 160, H 0, L 85
0x5087: Loading 0x00 from Register E to Register D
0x5088: 0x1d, A 0, B 0, C 0, D 0, E 0, F 160, H 0, L 85
0x5088: Register E Decreased to 255
0x5089: 0x18, A 0, B 0, C 0, D 0, E 255, F 224, H 0, L 85
0x5089: Jumping 0x0019 ops to 0x50a2
0x50a2: 0x58, A 0, B 0, C 0, D 0, E 255, F 224, H 0, L 85
0x50a2: Loading 0x00 from Register B to Register E
0x50a3: 0x58, A 0, B 0, C 0, D 0, E 0, F 224, H 0, L 85
0x50a3: Loading 0x00 from Register B to Register E
0x50a4: 0x58, A 0, B 0, C 0, D 0, E 0, F 224, H 0, L 85
0x50a4: Loading 0x00 from Register B to Register E
0x50a5: 0x6e, A 0, B 0, C 0, D 0, E 0, F 224, H 0, L 85
0x50a5: Setting value 0x00 to register L from location 0x0055
0x50a6: 0x56, A 0, B 0, C 0, D 0, E 0, F 224, H 0, L 0
0x50a6: Setting value 0x00 to register D from location 0x0000
0x50a7: 0x56, A 0, B 0, C 0, D 0, E 0, F 224, H 0, L 0
0x50a7: Setting value 0x00 to register D from location 0x0000
0x50a8: 0x56, A 0, B 0, C 0, D 0, E 0, F 224, H 0, L 0
0x50a8: Setting value 0x00 to register D from location 0x0000
0x50a9: 0x5a, A 0, B 0, C 0, D 0, E 0, F 224, H 0, L 0
0x50a9: Loading 0x00 from Register D to Register E
0x50aa: 0x4b, A 0, B 0, C 0, D 0, E 0, F 224, H 0, L 0
0x50aa: Loading 0x00 from Register E to Register C
0x50ab: 0x4a, A 0, B 0, C 0, D 0, E 0, F 224, H 0, L 0
0x50ab: Loading 0x00 from Register D to Register C
0x50ac: 0x5b, A 0, B 0, C 0, D 0, E 0, F 224, H 0, L 0
0x50ac: Loading 0x00 from Register E to Register E
0x50ad: 0x01, A 0, B 0, C 0, D 0, E 0, F 224, H 0, L 0
0x50ad: Loading 0x6f60 to Register DE
    D: 0x00 | E: 0x00
0x50b0: 0x60, A 0, B 111, C 96, D 0, E 0, F 224, H 0, L 0
0x50b0: Loading 0x6f from Register B to Register H
0x50b1: 0x60, A 0, B 111, C 96, D 0, E 0, F 224, H 111, L 0
0x50b1: Loading 0x6f from Register B to Register H
0x50b2: 0x60, A 0, B 111, C 96, D 0, E 0, F 224, H 111, L 0
0x50b2: Loading 0x6f from Register B to Register H
0x50b3: 0x60, A 0, B 111, C 96, D 0, E 0, F 224, H 111, L 0
0x50b3: Loading 0x6f from Register B to Register H
0x50b4: 0x60, A 0, B 111, C 96, D 0, E 0, F 224, H 111, L 0
0x50b4: Loading 0x6f from Register B to Register H
0x50b5: 0x2f, A 0, B 111, C 96, D 0, E 0, F 224, H 111, L 0
0x50b5: CPL
0x50b6: 0x2f, A 255, B 111, C 96, D 0, E 0, F 224, H 111, L 0
0x50b6: CPL
0x50b7: 0x60, A 0, B 111, C 96, D 0, E 0, F 224, H 111, L 0
0x50b7: Loading 0x6f from Register B to Register H
0x50b8: 0x60, A 0, B 111, C 96, D 0, E 0, F 224, H 111, L 0
0x50b8: Loading 0x6f from Register B to Register H
0x50b9: 0x60, A 0, B 111, C 96, D 0, E 0, F 224, H 111, L 0
0x50b9: Loading 0x6f from Register B to Register H
0x50ba: 0x60, A 0, B 111, C 96, D 0, E 0, F 224, H 111, L 0
0x50ba: Loading 0x6f from Register B to Register H
0x50bb: 0x60, A 0, B 111, C 96, D 0, E 0, F 224, H 111, L 0
0x50bb: Loading 0x6f from Register B to Register H
0x50bc: 0x60, A 0, B 111, C 96, D 0, E 0, F 224, H 111, L 0
0x50bc: Loading 0x6f from Register B to Register H
0x50bd: 0x5c, A 0, B 111, C 96, D 0, E 0, F 224, H 111, L 0
0x50bd: Loading 0x6f from Register H to Register E
0x50be: 0x4b, A 0, B 111, C 96, D 0, E 111, F 224, H 111, L 0
0x50be: Loading 0x6f from Register E to Register C
0x50bf: 0x4a, A 0, B 111, C 111, D 0, E 111, F 224, H 111, L 0
0x50bf: Loading 0x00 from Register D to Register C
0x50c0: 0x5b, A 0, B 111, C 0, D 0, E 111, F 224, H 111, L 0
0x50c0: Loading 0x6f from Register E to Register E
0x50c1: 0x02, A 0, B 111, C 0, D 0, E 111, F 224, H 111, L 0
0x50c2: 0x6f, A 0, B 111, C 0, D 0, E 111, F 224, H 111, L 0
0x50c2: Loading 0x00 from Register A to Register L
0x50c3: 0x60, A 0, B 111, C 0, D 0, E 111, F 224, H 111, L 0
0x50c3: Loading 0x6f from Register B to Register H
0x50c4: 0x60, A 0, B 111, C 0, D 0, E 111, F 224, H 111, L 0
0x50c4: Loading 0x6f from Register B to Register H
0x50c5: 0x60, A 0, B 111, C 0, D 0, E 111, F 224, H 111, L 0
0x50c5: Loading 0x6f from Register B to Register H
0x50c6: 0x60, A 0, B 111, C 0, D 0, E 111, F 224, H 111, L 0
0x50c6: Loading 0x6f from Register B to Register H
0x50c7: 0x60, A 0, B 111, C 0, D 0, E 111, F 224, H 111, L 0
0x50c7: Loading 0x6f from Register B to Register H
0x50c8: 0x60, A 0, B 111, C 0, D 0, E 111, F 224, H 111, L 0
0x50c8: Loading 0x6f from Register B to Register H
0x50c9: 0x2f, A 0, B 111, C 0, D 0, E 111, F 224, H 111, L 0
0x50c9: CPL
0x50ca: 0x2f, A 255, B 111, C 0, D 0, E 111, F 224, H 111, L 0
0x50ca: CPL
0x50cb: 0x60, A 0, B 111, C 0, D 0, E 111, F 224, H 111, L 0
0x50cb: Loading 0x6f from Register B to Register H
0x50cc: 0x60, A 0, B 111, C 0, D 0, E 111, F 224, H 111, L 0
0x50cc: Loading 0x6f from Register B to Register H
0x50cd: 0x60, A 0, B 111, C 0, D 0, E 111, F 224, H 111, L 0
0x50cd: Loading 0x6f from Register B to Register H
0x50ce: 0x60, A 0, B 111, C 0, D 0, E 111, F 224, H 111, L 0
0x50ce: Loading 0x6f from Register B to Register H
0x50cf: 0x60, A 0, B 111, C 0, D 0, E 111, F 224, H 111, L 0
0x50cf: Loading 0x6f from Register B to Register H
0x50d0: 0x60, A 0, B 111, C 0, D 0, E 111, F 224, H 111, L 0
0x50d0: Loading 0x6f from Register B to Register H
0x50d1: 0x5c, A 0, B 111, C 0, D 0, E 111, F 224, H 111, L 0
0x50d1: Loading 0x6f from Register H to Register E
0x50d2: 0x4b, A 0, B 111, C 0, D 0, E 111, F 224, H 111, L 0
0x50d2: Loading 0x6f from Register E to Register C
0x50d3: 0x4a, A 0, B 111, C 111, D 0, E 111, F 224, H 111, L 0
0x50d3: Loading 0x00 from Register D to Register C
0x50d4: 0x5b, A 0, B 111, C 0, D 0, E 111, F 224, H 111, L 0
0x50d4: Loading 0x6f from Register E to Register E
0x50d5: 0x03, A 0, B 111, C 0, D 0, E 111, F 224, H 111, L 0
0x50d5: Register BC Increased to 0x6f01
0x50d6: 0x6f, A 0, B 111, C 1, D 0, E 111, F 224, H 111, L 0
0x50d6: Loading 0x00 from Register A to Register L
0x50d7: 0x60, A 0, B 111, C 1, D 0, E 111, F 224, H 111, L 0
0x50d7: Loading 0x6f from Register B to Register H
0x50d8: 0x60, A 0, B 111, C 1, D 0, E 111, F 224, H 111, L 0
0x50d8: Loading 0x6f from Register B to Register H
0x50d9: 0x60, A 0, B 111, C 1, D 0, E 111, F 224, H 111, L 0
0x50d9: Loading 0x6f from Register B to Register H
0x50da: 0x60, A 0, B 111, C 1, D 0, E 111, F 224, H 111, L 0
0x50da: Loading 0x6f from Register B to Register H
0x50db: 0x60, A 0, B 111, C 1, D 0, E 111, F 224, H 111, L 0
0x50db: Loading 0x6f from Register B to Register H
0x50dc: 0x60, A 0, B 111, C 1, D 0, E 111, F 224, H 111, L 0
0x50dc: Loading 0x6f from Register B to Register H
0x50dd: 0x2f, A 0, B 111, C 1, D 0, E 111, F 224, H 111, L 0
0x50dd: CPL
0x50de: 0x2f, A 255, B 111, C 1, D 0, E 111, F 224, H 111, L 0
0x50de: CPL
0x50df: 0x60, A 0, B 111, C 1, D 0, E 111, F 224, H 111, L 0
0x50df: Loading 0x6f from Register B to Register H
0x50e0: 0x60, A 0, B 111, C 1, D 0, E 111, F 224, H 111, L 0
0x50e0: Loading 0x6f from Register B to Register H
0x50e1: 0x60, A 0, B 111, C 1, D 0, E 111, F 224, H 111, L 0
0x50e1: Loading 0x6f from Register B to Register H
0x50e2: 0x60, A 0, B 111, C 1, D 0, E 111, F 224, H 111, L 0
0x50e2: Loading 0x6f from Register B to Register H
0x50e3: 0x60, A 0, B 111, C 1, D 0, E 111, F 224, H 111, L 0
0x50e3: Loading 0x6f from Register B to Register H
0x50e4: 0x60, A 0, B 111, C 1, D 0, E 111, F 224, H 111, L 0
0x50e4: Loading 0x6f from Register B to Register H
0x50e5: 0x5c, A 0, B 111, C 1, D 0, E 111, F 224, H 111, L 0
0x50e5: Loading 0x6f from Register H to Register E
0x50e6: 0x4b, A 0, B 111, C 1, D 0, E 111, F 224, H 111, L 0
0x50e6: Loading 0x6f from Register E to Register C
0x50e7: 0x4a, A 0, B 111, C 111, D 0, E 111, F 224, H 111, L 0
0x50e7: Loading 0x00 from Register D to Register C
0x50e8: 0x2d, A 0, B 111, C 0, D 0, E 111, F 224, H 111, L 0
0x50e8: Register L Decreased to 255
0x50e9: 0x4f, A 0, B 111, C 0, D 0, E 111, F 224, H 111, L 255
0x50e9: Loading 0x00 from Register A to Register C
0x50ea: 0x6b, A 0, B 111, C 0, D 0, E 111, F 224, H 111, L 255
0x50ea: Loading 0x6f from Register E to Register L
0x50eb: 0x4f, A 0, B 111, C 0, D 0, E 111, F 224, H 111, L 111
0x50eb: Loading 0x00 from Register A to Register C
0x50ec: 0x4f, A 0, B 111, C 0, D 0, E 111, F 224, H 111, L 111
0x50ec: Loading 0x00 from Register A to Register C
0x50ed: 0x4f, A 0, B 111, C 0, D 0, E 111, F 224, H 111, L 111
0x50ed: Loading 0x00 from Register A to Register C
0x50ee: 0x4f, A 0, B 111, C 0, D 0, E 111, F 224, H 111, L 111
0x50ee: Loading 0x00 from Register A to Register C
0x50ef: 0x4f, A 0, B 111, C 0, D 0, E 111, F 224, H 111, L 111
0x50ef: Loading 0x00 from Register A to Register C
0x50f0: 0x4f, A 0, B 111, C 0, D 0, E 111, F 224, H 111, L 111
0x50f0: Loading 0x00 from Register A to Register C
0x50f1: 0x4f, A 0, B 111, C 0, D 0, E 111, F 224, H 111, L 111
0x50f1: Loading 0x00 from Register A to Register C
0x50f2: 0x4f, A 0, B 111, C 0, D 0, E 111, F 224, H 111, L 111
0x50f2: Loading 0x00 from Register A to Register C
0x50f3: 0x4f, A 0, B 111, C 0, D 0, E 111, F 224, H 111, L 111
0x50f3: Loading 0x00 from Register A to Register C
0x50f4: 0x4f, A 0, B 111, C 0, D 0, E 111, F 224, H 111, L 111
0x50f4: Loading 0x00 from Register A to Register C
0x50f5: 0x4f, A 0, B 111, C 0, D 0, E 111, F 224, H 111, L 111
0x50f5: Loading 0x00 from Register A to Register C
0x50f6: 0x4f, A 0, B 111, C 0, D 0, E 111, F 224, H 111, L 111
0x50f6: Loading 0x00 from Register A to Register C
0x50f7: 0x4f, A 0, B 111, C 0, D 0, E 111, F 224, H 111, L 111
0x50f7: Loading 0x00 from Register A to Register C
0x50f8: 0x4f, A 0, B 111, C 0, D 0, E 111, F 224, H 111, L 111
0x50f8: Loading 0x00 from Register A to Register C
0x50f9: 0x2e, A 0, B 111, C 0, D 0, E 111, F 224, H 111, L 111
0x50f9: Loading 0x004b to Register L
0x50fb: 0x4c, A 0, B 111, C 0, D 0, E 111, F 224, H 111, L 75
0x50fb: Loading 0x6f from Register H to Register C
0x50fc: 0x4d, A 0, B 111, C 111, D 0, E 111, F 224, H 111, L 75
0x50fc: Loading 0x4b from Register L to Register C
0x50fd: 0x4d, A 0, B 111, C 75, D 0, E 111, F 224, H 111, L 75
0x50fd: Loading 0x4b from Register L to Register C
0x50fe: 0x4d, A 0, B 111, C 75, D 0, E 111, F 224, H 111, L 75
0x50fe: Loading 0x4b from Register L to Register C
0x50ff: 0x4d, A 0, B 111, C 75, D 0, E 111, F 224, H 111, L 75
0x50ff: Loading 0x4b from Register L to Register C
0x5100: 0x4d, A 0, B 111, C 75, D 0, E 111, F 224, H 111, L 75
0x5100: Loading 0x4b from Register L to Register C
0x5101: 0x4d, A 0, B 111, C 75, D 0, E 111, F 224, H 111, L 75
0x5101: Loading 0x4b from Register L to Register C
0x5102: 0x4d, A 0, B 111, C 75, D 0, E 111, F 224, H 111, L 75
0x5102: Loading 0x4b from Register L to Register C
0x5103: 0x4d, A 0, B 111, C 75, D 0, E 111, F 224, H 111, L 75
0x5103: Loading 0x4b from Register L to Register C
0x5104: 0x4d, A 0, B 111, C 75, D 0, E 111, F 224, H 111, L 75
0x5104: Loading 0x4b from Register L to Register C
0x5105: 0x4d, A 0, B 111, C 75, D 0, E 111, F 224, H 111, L 75
0x5105: Loading 0x4b from Register L to Register C
0x5106: 0x4d, A 0, B 111, C 75, D 0, E 111, F 224, H 111, L 75
0x5106: Loading 0x4b from Register L to Register C
0x5107: 0x4d, A 0, B 111, C 75, D 0, E 111, F 224, H 111, L 75
0x5107: Loading 0x4b from Register L to Register C
0x5108: 0x4d, A 0, B 111, C 75, D 0, E 111, F 224, H 111, L 75
0x5108: Loading 0x4b from Register L to Register C
0x5109: 0x4d, A 0, B 111, C 75, D 0, E 111, F 224, H 111, L 75
0x5109: Loading 0x4b from Register L to Register C
0x510a: 0x4d, A 0, B 111, C 75, D 0, E 111, F 224, H 111, L 75
0x510a: Loading 0x4b from Register L to Register C
0x510b: 0x4d, A 0, B 111, C 75, D 0, E 111, F 224, H 111, L 75
0x510b: Loading 0x4b from Register L to Register C
0x510c: 0x4d, A 0, B 111, C 75, D 0, E 111, F 224, H 111, L 75
0x510c: Loading 0x4b from Register L to Register C
0x510d: 0x4d, A 0, B 111, C 75, D 0, E 111, F 224, H 111, L 75
0x510d: Loading 0x4b from Register L to Register C
0x510e: 0x4e, A 0, B 111, C 75, D 0, E 111, F 224, H 111, L 75
0x510e: Setting value 0x00 to register C from location 0x6f4b
0x510f: 0xcd, A 0, B 111, C 0, D 0, E 111, F 224, H 111, L 75
